mysql> SOURCE C:\Users\15856\Documents\Database\HomeWork\hw3\khorramrouz_hw3_p1.sql
Database changed
--------------
SELECT headOfState
 FROM country
 WHERE localName = "United States"
--------------

+-----------------+
| headOfState     |
+-----------------+
| Donald J. Trump |
+-----------------+
1 row in set (0.00 sec)

--------------
UPDATE country
 SET headOfState = "Joseph R. Biden Jr."
 WHERE localName = "United States"
--------------

Query OK, 1 row affected (0.00 sec)
Rows matched: 1  Changed: 1  Warnings: 0

--------------
SELECT headOfState
 FROM country
 WHERE localName = "United States"
--------------

+---------------------+
| headOfState         |
+---------------------+
| Joseph R. Biden Jr. |
+---------------------+
1 row in set (0.00 sec)

--------------
SELECT NAME
 FROM country
 WHERE indepYear IS NULL
--------------

+----------------------------------------------+
| NAME                                         |
+----------------------------------------------+
| Aruba                                        |
| Anguilla                                     |
| Netherlands Antilles                         |
| American Samoa                               |
| Antarctica                                   |
| French Southern territories                  |
| Bermuda                                      |
| Bouvet Island                                |
| Cocos (Keeling) Islands                      |
| Cook Islands                                 |
| Christmas Island                             |
| Cayman Islands                               |
| Western Sahara                               |
| Falkland Islands                             |
| Faroe Islands                                |
| Gibraltar                                    |
| Guadeloupe                                   |
| Greenland                                    |
| French Guiana                                |
| Guam                                         |
| Hong Kong                                    |
| Heard Island and McDonald Islands            |
| British Indian Ocean Territory               |
| Macao                                        |
| Northern Mariana Islands                     |
| Montserrat                                   |
| Martinique                                   |
| Mayotte                                      |
| New Caledonia                                |
| Norfolk Island                               |
| Niue                                         |
| Pitcairn                                     |
| Puerto Rico                                  |
| Palestine                                    |
| French Polynesia                             |
| RÈunion                                     |
| South Georgia and the South Sandwich Islands |
| Saint Helena                                 |
| Svalbard and Jan Mayen                       |
| Saint Pierre and Miquelon                    |
| Turks and Caicos Islands                     |
| Tokelau                                      |
| East Timor                                   |
| United States Minor Outlying Islands         |
| Virgin Islands, British                      |
| Virgin Islands, U.S.                         |
| Wallis and Futuna                            |
+----------------------------------------------+
47 rows in set (0.00 sec)

--------------
SELECT name, continent
 FROM country
 WHERE population >= 1000000000 AND lifeExpectancy BETWEEN 70 AND 80
--------------

+-------+-----------+
| name  | continent |
+-------+-----------+
| China | Asia      |
+-------+-----------+
1 row in set (0.01 sec)

--------------
SELECT NAME
 FROM country
 WHERE continent in("North America","South America")
--------------

+----------------------------------+
| NAME                             |
+----------------------------------+
| Aruba                            |
| Anguilla                         |
| Netherlands Antilles             |
| Argentina                        |
| Antigua and Barbuda              |
| Bahamas                          |
| Belize                           |
| Bermuda                          |
| Bolivia                          |
| Brazil                           |
| Barbados                         |
| Canada                           |
| Chile                            |
| Colombia                         |
| Costa Rica                       |
| Cuba                             |
| Cayman Islands                   |
| Dominica                         |
| Dominican Republic               |
| Ecuador                          |
| Falkland Islands                 |
| Guadeloupe                       |
| Grenada                          |
| Greenland                        |
| Guatemala                        |
| French Guiana                    |
| Guyana                           |
| Honduras                         |
| Haiti                            |
| Jamaica                          |
| Saint Kitts and Nevis            |
| Saint Lucia                      |
| Mexico                           |
| Montserrat                       |
| Martinique                       |
| Nicaragua                        |
| Panama                           |
| Peru                             |
| Puerto Rico                      |
| Paraguay                         |
| El Salvador                      |
| Saint Pierre and Miquelon        |
| Suriname                         |
| Turks and Caicos Islands         |
| Trinidad and Tobago              |
| Uruguay                          |
| United States                    |
| Saint Vincent and the Grenadines |
| Venezuela                        |
| Virgin Islands, British          |
| Virgin Islands, U.S.             |
+----------------------------------+
51 rows in set (0.00 sec)

mysql> ^C
mysql> notee
